Available devices:event number [0-1]: ^C[charlyo@fedora bthidhub]$ sudo hid-recorder
/dev/hidraw0:   SYNA8005:00 06CB:CD8C
/dev/hidraw1:   Logitech MX Master 3S
/dev/hidraw2:   Bluetooth HID Hub - RPi
Select the device event number [0-2]: 2
# Bluetooth HID Hub - RPi
# 0x05, 0x01,                    // Usage Page (Generic Desktop)        0
# 0x09, 0x06,                    // Usage (Keyboard)                    2
# 0xa1, 0x01,                    // Collection (Application)            4
# 0x85, 0x01,                    //  Report ID (1)                      6
# 0x05, 0x07,                    //  Usage Page (Keyboard)              8
# 0x19, 0xe0,                    //  Usage Minimum (224)                10
# 0x29, 0xe7,                    //  Usage Maximum (231)                12
# 0x15, 0x00,                    //  Logical Minimum (0)                14
# 0x25, 0x01,                    //  Logical Maximum (1)                16
# 0x75, 0x01,                    //  Report Size (1)                    18
# 0x95, 0x08,                    //  Report Count (8)                   20
# 0x81, 0x02,                    //  Input (Data,Var,Abs)               22
# 0x95, 0x01,                    //  Report Count (1)                   24
# 0x75, 0x08,                    //  Report Size (8)                    26
# 0x81, 0x03,                    //  Input (Cnst,Var,Abs)               28
# 0x95, 0x05,                    //  Report Count (5)                   30
# 0x75, 0x01,                    //  Report Size (1)                    32
# 0x05, 0x08,                    //  Usage Page (LEDs)                  34
# 0x19, 0x01,                    //  Usage Minimum (1)                  36
# 0x29, 0x05,                    //  Usage Maximum (5)                  38
# 0x91, 0x02,                    //  Output (Data,Var,Abs)              40
# 0x95, 0x01,                    //  Report Count (1)                   42
# 0x75, 0x03,                    //  Report Size (3)                    44
# 0x91, 0x03,                    //  Output (Cnst,Var,Abs)              46
# 0x95, 0x06,                    //  Report Count (6)                   48
# 0x75, 0x08,                    //  Report Size (8)                    50
# 0x15, 0x00,                    //  Logical Minimum (0)                52
# 0x25, 0x6d,                    //  Logical Maximum (109)              54
# 0x05, 0x07,                    //  Usage Page (Keyboard)              56
# 0x19, 0x00,                    //  Usage Minimum (0)                  58
# 0x29, 0x6d,                    //  Usage Maximum (109)                60
# 0x81, 0x00,                    //  Input (Data,Arr,Abs)               62
# 0xc0,                          // End Collection                      64
# 0x05, 0x0c,                    // Usage Page (Consumer Devices)       65
# 0x09, 0x01,                    // Usage (Consumer Control)            67
# 0xa1, 0x01,                    // Collection (Application)            69
# 0x85, 0x02,                    //  Report ID (2)                      71
# 0x05, 0x0c,                    //  Usage Page (Consumer Devices)      73
# 0x15, 0x00,                    //  Logical Minimum (0)                75
# 0x25, 0x01,                    //  Logical Maximum (1)                77
# 0x75, 0x01,                    //  Report Size (1)                    79
# 0x95, 0x07,                    //  Report Count (7)                   81
# 0x09, 0xb5,                    //  Usage (Scan Next Track)            83
# 0x09, 0xb6,                    //  Usage (Scan Previous Track)        85
# 0x09, 0xb7,                    //  Usage (Stop)                       87
# 0x09, 0xcd,                    //  Usage (Play/Pause)                 89
# 0x09, 0xe2,                    //  Usage (Mute)                       91
# 0x09, 0xe9,                    //  Usage (Volume Up)                  93
# 0x09, 0xea,                    //  Usage (Volume Down)                95
# 0x81, 0x02,                    //  Input (Data,Var,Abs)               97
# 0x95, 0x01,                    //  Report Count (1)                   99
# 0x81, 0x01,                    //  Input (Cnst,Arr,Abs)               101
# 0xc0,                          // End Collection                      103
# 0x05, 0x01,                    // Usage Page (Generic Desktop)        104
# 0x09, 0x02,                    // Usage (Mouse)                       106
# 0xa1, 0x01,                    // Collection (Application)            108
# 0x09, 0x01,                    //  Usage (Pointer)                    110
# 0xa1, 0x00,                    //  Collection (Physical)              112
# 0x85, 0x03,                    //   Report ID (3)                     114
# 0x05, 0x09,                    //   Usage Page (Button)               116
# 0x19, 0x01,                    //   Usage Minimum (1)                 118
# 0x29, 0x10,                    //   Usage Maximum (16)                120
# 0x15, 0x00,                    //   Logical Minimum (0)               122
# 0x25, 0x01,                    //   Logical Maximum (1)               124
# 0x95, 0x10,                    //   Report Count (16)                 126
# 0x75, 0x01,                    //   Report Size (1)                   128
# 0x81, 0x02,                    //   Input (Data,Var,Abs)              130
# 0x05, 0x01,                    //   Usage Page (Generic Desktop)      132
# 0x16, 0x01, 0x80,              //   Logical Minimum (-32767)          134
# 0x26, 0xff, 0x7f,              //   Logical Maximum (32767)           137
# 0x75, 0x10,                    //   Report Size (16)                  140
# 0x95, 0x02,                    //   Report Count (2)                  142
# 0x09, 0x30,                    //   Usage (X)                         144
# 0x09, 0x31,                    //   Usage (Y)                         146
# 0x81, 0x06,                    //   Input (Data,Var,Rel)              148
# 0x15, 0x81,                    //   Logical Minimum (-127)            150
# 0x25, 0x7f,                    //   Logical Maximum (127)             152
# 0x75, 0x08,                    //   Report Size (8)                   154
# 0x95, 0x01,                    //   Report Count (1)                  156
# 0x09, 0x38,                    //   Usage (Wheel)                     158
# 0x81, 0x06,                    //   Input (Data,Var,Rel)              160
# 0xc0,                          //  End Collection                     162
# 0xc0,                          // End Collection                      163
#
R: 164 05 01 09 06 a1 01 85 01 05 07 19 e0 29 e7 15 00 25 01 75 01 95 08 81 02 95 01 75 08 81 03 95 05 75 01 05 08 19 01 29 05 91 02 95 01 75 03 91 03 95 06 75 08 15 00 25 6d 05 07 19 00 29 6d 81 00 c0 05 0c 09 01 a1 01 85 02 05 0c 15 00 25 01 75 01 95 07 09 b5 09 b6 09 b7 09 cd 09 e2 09 e9 09 ea 81 02 95 01 81 01 c0 05 01 09 02 a1 01 09 01 a1 00 85 03 05 09 19 01 29 10 15 00 25 01 95 10 75 01 81 02 05 01 16 01 80 26 ff 7f 75 10 95 02 09 30 09 31 81 06 15 81 25 7f 75 08 95 01 09 38 81 06 c0 c0
N: Bluetooth HID Hub - RPi
I: 5 1d6b 0246
# ReportID: 1 / LeftControl: 0 | LeftShift: 0 | LeftAlt: 0 | Left GUI: 0 | RightControl: 0 | RightShift: 0 | RightAlt: 0 | Right GUI: 0 | # |Keyboard ['0x70000', '0x70000', '0x70000', '0x70000', '0x70000', '0x70000']
E: 000000.000000 9 01 00 00 00 00 00 00 00 00
# ReportID: 1 / LeftControl: 0 | LeftShift: 0 | LeftAlt: 0 | Left GUI: 0 | RightControl: 0 | RightShift: 0 | RightAlt: 0 | Right GUI: 0 | # |Keyboard ['Caps Lock', '0x70000', '0x70000', '0x70000', '0x70000', '0x70000']
E: 000002.153194 9 01 00 00 39 00 00 00 00 00
# ReportID: 1 / LeftControl: 0 | LeftShift: 0 | LeftAlt: 0 | Left GUI: 0 | RightControl: 0 | RightShift: 0 | RightAlt: 0 | Right GUI: 0 | # |Keyboard ['0x70000', '0x70000', '0x70000', '0x70000', '0x70000', '0x70000']
E: 000002.213212 9 01 00 00 00 00 00 00 00 00
# ReportID: 1 / LeftControl: 0 | LeftShift: 0 | LeftAlt: 0 | Left GUI: 0 | RightControl: 0 | RightShift: 0 | RightAlt: 0 | Right GUI: 0 | # |Keyboard ['Caps Lock', '0x70000', '0x70000', '0x70000', '0x70000', '0x70000']
E: 000004.811901 9 01 00 00 39 00 00 00 00 00
# ReportID: 1 / LeftControl: 0 | LeftShift: 0 | LeftAlt: 0 | Left GUI: 0 | RightControl: 0 | RightShift: 0 | RightAlt: 0 | Right GUI: 0 | # |Keyboard ['0x70000', '0x70000', '0x70000', '0x70000', '0x70000', '0x70000']
E: 000004.822857 9 01 00 00 00 00 00 00 00 00
# ReportID: 1 / LeftControl: 0 | LeftShift: 0 | LeftAlt: 0 | Left GUI: 0 | RightControl: 0 | RightShift: 0 | RightAlt: 0 | Right GUI: 0 | # |Keyboard ['Keypad Num Lock and Clear', '0x70000', '0x70000', '0x70000', '0x70000', '0x70000']
E: 000006.714317 9 01 00 00 53 00 00 00 00 00
# ReportID: 1 / LeftControl: 0 | LeftShift: 0 | LeftAlt: 0 | Left GUI: 0 | RightControl: 0 | RightShift: 0 | RightAlt: 0 | Right GUI: 0 | # |Keyboard ['0x70000', '0x70000', '0x70000', '0x70000', '0x70000', '0x70000']
E: 000006.781961 9 01 00 00 00 00 00 00 00 00
# ReportID: 1 / LeftControl: 0 | LeftShift: 0 | LeftAlt: 0 | Left GUI: 0 | RightControl: 0 | RightShift: 0 | RightAlt: 0 | Right GUI: 0 | # |Keyboard ['Keypad *', '0x70000', '0x70000', '0x70000', '0x70000', '0x70000']
E: 000042.569956 9 01 00 00 55 00 00 00 00 00
*# ReportID: 1 / LeftControl: 0 | LeftShift: 0 | LeftAlt: 0 | Left GUI: 0 | RightControl: 0 | RightShift: 0 | RightAlt: 0 | Right GUI: 0 | # |Keyboard ['0x70000', '0x70000', '0x70000', '0x70000', '0x70000', '0x70000']
E: 000042.666110 9 01 00 00 00 00 00 00 00 00
# ReportID: 1 / LeftControl: 0 | LeftShift: 0 | LeftAlt: 0 | Left GUI: 0 | RightControl: 0 | RightShift: 0 | RightAlt: 0 | Right GUI: 0 | # |Keyboard ['Caps Lock', '0x70000', '0x70000', '0x70000', '0x70000', '0x70000']
E: 000047.239129 9 01 00 00 39 00 00 00 00 00
# ReportID: 1 / LeftControl: 0 | LeftShift: 0 | LeftAlt: 0 | Left GUI: 0 | RightControl: 0 | RightShift: 0 | RightAlt: 0 | Right GUI: 0 | # |Keyboard ['0x70000', '0x70000', '0x70000', '0x70000', '0x70000', '0x70000']
E: 000047.240427 9 01 00 00 00 00 00 00 00 00
# ReportID: 1 / LeftControl: 0 | LeftShift: 0 | LeftAlt: 1 | Left GUI: 0 | RightControl: 0 | RightShift: 0 | RightAlt: 0 | Right GUI: 0 | # |Keyboard ['0x70000', '0x70000', '0x70000', '0x70000', '0x70000', '0x70000']
E: 000048.046036 9 01 04 00 00 00 00 00 00 00
# ReportID: 1 / LeftControl: 0 | LeftShift: 0 | LeftAlt: 1 | Left GUI: 0 | RightControl: 0 | RightShift: 0 | RightAlt: 0 | Right GUI: 0 | # |Keyboard ['Tab', '0x70000', '0x70000', '0x70000', '0x70000', '0x70000']
E: 000048.133241 9 01 04 00 2b 00 00 00 00 00
# ReportID: 1 / LeftControl: 0 | LeftShift: 0 | LeftAlt: 0 | Left GUI: 0 | RightControl: 0 | RightShift: 0 | RightAlt: 0 | Right GUI: 0 | # |Keyboard ['Tab', '0x70000', '0x70000', '0x70000', '0x70000', '0x70000']
E: 000048.189735 9 01 00 00 2b 00 00 00 00 00
# ReportID: 1 / LeftControl: 0 | LeftShift: 0 | LeftAlt: 0 | Left GUI: 0 | RightControl: 0 | RightShift: 0 | RightAlt: 0 | Right GUI: 0 | # |Keyboard ['0x70000', '0x70000', '0x70000', '0x70000', '0x70000', '0x70000']
E: 000048.226856 9 01 00 00 00 00 00 00 00 00
# ReportID: 1 / LeftControl: 0 | LeftShift: 0 | LeftAlt: 1 | Left GUI: 0 | RightControl: 0 | RightShift: 0 | RightAlt: 0 | Right GUI: 0 | # |Keyboard ['0x70000', '0x70000', '0x70000', '0x70000', '0x70000', '0x70000']
E: 000048.605225 9 01 04 00 00 00 00 00 00 00
# ReportID: 1 / LeftControl: 0 | LeftShift: 0 | LeftAlt: 1 | Left GUI: 0 | RightControl: 0 | RightShift: 0 | RightAlt: 0 | Right GUI: 0 | # |Keyboard ['Tab', '0x70000', '0x70000', '0x70000', '0x70000', '0x70000']
E: 000048.712258 9 01 04 00 2b 00 00 00 00 00
# ReportID: 1 / LeftControl: 0 | LeftShift: 0 | LeftAlt: 1 | Left GUI: 0 | RightControl: 0 | RightShift: 0 | RightAlt: 0 | Right GUI: 0 | # |Keyboard ['0x70000', '0x70000', '0x70000', '0x70000', '0x70000', '0x70000']
E: 000048.821820 9 01 04 00 00 00 00 00 00 00
# ReportID: 1 / LeftControl: 0 | LeftShift: 0 | LeftAlt: 1 | Left GUI: 0 | RightControl: 0 | RightShift: 0 | RightAlt: 0 | Right GUI: 0 | # |Keyboard ['Tab', '0x70000', '0x70000', '0x70000', '0x70000', '0x70000']
E: 000049.708093 9 01 04 00 2b 00 00 00 00 00
# ReportID: 1 / LeftControl: 0 | LeftShift: 0 | LeftAlt: 1 | Left GUI: 0 | RightControl: 0 | RightShift: 0 | RightAlt: 0 | Right GUI: 0 | # |Keyboard ['0x70000', '0x70000', '0x70000', '0x70000', '0x70000', '0x70000']
E: 000049.812118 9 01 04 00 00 00 00 00 00 00
# ReportID: 1 / LeftControl: 0 | LeftShift: 0 | LeftAlt: 0 | Left GUI: 0 | RightControl: 0 | RightShift: 0 | RightAlt: 0 | Right GUI: 0 | # |Keyboard ['0x70000', '0x70000', '0x70000', '0x70000', '0x70000', '0x70000']
E: 000050.645129 9 01 00 00 00 00 00 00 00 00
# ReportID: 1 / LeftControl: 0 | LeftShift: 0 | LeftAlt: 1 | Left GUI: 0 | RightControl: 0 | RightShift: 0 | RightAlt: 0 | Right GUI: 0 | # |Keyboard ['0x70000', '0x70000', '0x70000', '0x70000', '0x70000', '0x70000']
E: 000060.306039 9 01 04 00 00 00 00 00 00 00
# ReportID: 1 / LeftControl: 0 | LeftShift: 0 | LeftAlt: 1 | Left GUI: 0 | RightControl: 0 | RightShift: 0 | RightAlt: 0 | Right GUI: 0 | # |Keyboard ['Tab', '0x70000', '0x70000', '0x70000', '0x70000', '0x70000']
E: 000060.400764 9 01 04 00 2b 00 00 00 00 00
# ReportID: 1 / LeftControl: 0 | LeftShift: 0 | LeftAlt: 0 | Left GUI: 0 | RightControl: 0 | RightShift: 0 | RightAlt: 0 | Right GUI: 0 | # |Keyboard ['Tab', '0x70000', '0x70000', '0x70000', '0x70000', '0x70000']
E: 000060.454806 9 01 00 00 2b 00 00 00 00 00
# ReportID: 1 / LeftControl: 0 | LeftShift: 0 | LeftAlt: 0 | Left GUI: 0 | RightControl: 0 | RightShift: 0 | RightAlt: 0 | Right GUI: 0 | # |Keyboard ['0x70000', '0x70000', '0x70000', '0x70000', '0x70000', '0x70000']
E: 000060.486826 9 01 00 00 00 00 00 00 00 00
# ReportID: 1 / LeftControl: 0 | LeftShift: 0 | LeftAlt: 1 | Left GUI: 0 | RightControl: 0 | RightShift: 0 | RightAlt: 0 | Right GUI: 0 | # |Keyboard ['0x70000', '0x70000', '0x70000', '0x70000', '0x70000', '0x70000']
E: 000060.916740 9 01 04 00 00 00 00 00 00 00
# ReportID: 1 / LeftControl: 0 | LeftShift: 0 | LeftAlt: 1 | Left GUI: 0 | RightControl: 0 | RightShift: 0 | RightAlt: 0 | Right GUI: 0 | # |Keyboard ['Tab', '0x70000', '0x70000', '0x70000', '0x70000', '0x70000']
E: 000060.968876 9 01 04 00 2b 00 00 00 00 00
# ReportID: 1 / LeftControl: 0 | LeftShift: 0 | LeftAlt: 1 | Left GUI: 0 | RightControl: 0 | RightShift: 0 | RightAlt: 0 | Right GUI: 0 | # |Keyboard ['0x70000', '0x70000', '0x70000', '0x70000', '0x70000', '0x70000']
E: 000061.066171 9 01 04 00 00 00 00 00 00 00
# ReportID: 1 / LeftControl: 0 | LeftShift: 0 | LeftAlt: 1 | Left GUI: 0 | RightControl: 0 | RightShift: 0 | RightAlt: 0 | Right GUI: 0 | # |Keyboard ['Tab', '0x70000', '0x70000', '0x70000', '0x70000', '0x70000']
E: 000061.152847 9 01 04 00 2b 00 00 00 00 00
# ReportID: 1 / LeftControl: 0 | LeftShift: 0 | LeftAlt: 1 | Left GUI: 0 | RightControl: 0 | RightShift: 0 | RightAlt: 0 | Right GUI: 0 | # |Keyboard ['0x70000', '0x70000', '0x70000', '0x70000', '0x70000', '0x70000']
E: 000061.243087 9 01 04 00 00 00 00 00 00 00
# ReportID: 1 / LeftControl: 0 | LeftShift: 0 | LeftAlt: 0 | Left GUI: 0 | RightControl: 0 | RightShift: 0 | RightAlt: 0 | Right GUI: 0 | # |Keyboard ['0x70000', '0x70000', '0x70000', '0x70000', '0x70000', '0x70000']
E: 000061.258080 9 01 00 00 00 00 00 00 00 00
# ReportID: 1 / LeftControl: 0 | LeftShift: 0 | LeftAlt: 1 | Left GUI: 0 | RightControl: 0 | RightShift: 0 | RightAlt: 0 | Right GUI: 0 | # |Keyboard ['0x70000', '0x70000', '0x70000', '0x70000', '0x70000', '0x70000']
E: 000061.771009 9 01 04 00 00 00 00 00 00 00
# ReportID: 1 / LeftControl: 0 | LeftShift: 0 | LeftAlt: 1 | Left GUI: 0 | RightControl: 0 | RightShift: 0 | RightAlt: 0 | Right GUI: 0 | # |Keyboard ['Tab', '0x70000', '0x70000', '0x70000', '0x70000', '0x70000']
E: 000061.807792 9 01 04 00 2b 00 00 00 00 00
# ReportID: 1 / LeftControl: 0 | LeftShift: 0 | LeftAlt: 1 | Left GUI: 0 | RightControl: 0 | RightShift: 0 | RightAlt: 0 | Right GUI: 0 | # |Keyboard ['0x70000', '0x70000', '0x70000', '0x70000', '0x70000', '0x70000']
E: 000061.910084 9 01 04 00 00 00 00 00 00 00
# ReportID: 1 / LeftControl: 0 | LeftShift: 0 | LeftAlt: 1 | Left GUI: 0 | RightControl: 0 | RightShift: 0 | RightAlt: 0 | Right GUI: 0 | # |Keyboard ['Tab', '0x70000', '0x70000', '0x70000', '0x70000', '0x70000']
E: 000062.210292 9 01 04 00 2b 00 00 00 00 00
# ReportID: 1 / LeftControl: 0 | LeftShift: 0 | LeftAlt: 1 | Left GUI: 0 | RightControl: 0 | RightShift: 0 | RightAlt: 0 | Right GUI: 0 | # |Keyboard ['0x70000', '0x70000', '0x70000', '0x70000', '0x70000', '0x70000']
E: 000062.322025 9 01 04 00 00 00 00 00 00 00
# ReportID: 1 / LeftControl: 0 | LeftShift: 0 | LeftAlt: 0 | Left GUI: 0 | RightControl: 0 | RightShift: 0 | RightAlt: 0 | Right GUI: 0 | # |Keyboard ['0x70000', '0x70000', '0x70000', '0x70000', '0x70000', '0x70000']
E: 000063.486036 9 01 00 00 00 00 00 00 00 00
# ReportID: 1 / LeftControl: 0 | LeftShift: 0 | LeftAlt: 0 | Left GUI: 0 | RightControl: 0 | RightShift: 0 | RightAlt: 0 | Right GUI: 0 | # |Keyboard ['Caps Lock', '0x70000', '0x70000', '0x70000', '0x70000', '0x70000']
E: 000065.957223 9 01 00 00 39 00 00 00 00 00
# ReportID: 1 / LeftControl: 0 | LeftShift: 0 | LeftAlt: 0 | Left GUI: 0 | RightControl: 0 | RightShift: 0 | RightAlt: 0 | Right GUI: 0 | # |Keyboard ['0x70000', '0x70000', '0x70000', '0x70000', '0x70000', '0x70000']
E: 000066.125278 9 01 00 00 00 00 00 00 00 00
E: 000077.606189 4 03 00 08 00
E: 000077.606512 4 03 00 00 00
E: 000080.673009 4 03 00 08 00
E: 000080.673294 4 03 00 00 00
E: 000082.180224 4 03 00 04 00
E: 000082.254139 4 03 00 00 00
E: 000083.376175 4 03 00 02 00
E: 000083.446231 4 03 00 00 00
E: 000084.091089 4 03 00 01 00
E: 000084.164175 4 03 00 00 00
E: 000085.773174 4 03 00 10 00
E: 000085.855252 4 03 00 00 00
E: 000086.316313 4 03 00 40 00
E: 000086.439250 4 03 00 00 00
E: 000086.665033 4 03 00 20 00
E: 000086.753219 4 03 00 00 00
# ReportID: 1 / LeftControl: 1 | LeftShift: 0 | LeftAlt: 0 | Left GUI: 0 | RightControl: 0 | RightShift: 0 | RightAlt: 0 | Right GUI: 0 | # |Keyboard ['0x70000', '0x70000', '0x70000', '0x70000', '0x70000', '0x70000']
E: 000092.073119 9 01 01 00 00 00 00 00 00 00
# ReportID: 1 / LeftControl: 1 | LeftShift: 0 | LeftAlt: 0 | Left GUI: 0 | RightControl: 0 | RightShift: 0 | RightAlt: 0 | Right GUI: 0 | # |Keyboard ['c and C', '0x70000', '0x70000', '0x70000', '0x70000', '0x70000']
E: 000092.074362 9 01 01 00 06 00 00 00 00 00
# ReportID: 1 / LeftControl: 1 | LeftShift: 0 | LeftAlt: 0 | Left GUI: 0 | RightControl: 0 | RightShift: 0 | RightAlt: 0 | Right GUI: 0 | # |Keyboard ['0x70000', '0x70000', '0x70000', '0x70000', '0x70000', '0x70000']
E: 000092.075953 9 01 01 00 00 00 00 00 00 00
^C[charlyo@fedora bthidhub]$ sudo hid-recorder
Available devices:
/dev/hidraw0:   SYNA8005:00 06CB:CD8C
/dev/hidraw1:   Logitech MX Master 3S
/dev/hidraw2:   CM Storm Quickfire TKL 6keys
/dev/hidraw3:   CM Storm Quickfire TKL 6keys
Select the device event number [0-3]: 2
# CM Storm Quickfire TKL 6keys
# 0x05, 0x01,                    // Usage Page (Generic Desktop)        0
# 0x09, 0x06,                    // Usage (Keyboard)                    2
# 0xa1, 0x01,                    // Collection (Application)            4
# 0x05, 0x07,                    //  Usage Page (Keyboard)              6
# 0x19, 0xe0,                    //  Usage Minimum (224)                8
# 0x29, 0xe7,                    //  Usage Maximum (231)                10
# 0x15, 0x00,                    //  Logical Minimum (0)                12
# 0x25, 0x01,                    //  Logical Maximum (1)                14
# 0x75, 0x01,                    //  Report Size (1)                    16
# 0x95, 0x08,                    //  Report Count (8)                   18
# 0x81, 0x02,                    //  Input (Data,Var,Abs)               20
# 0x95, 0x01,                    //  Report Count (1)                   22
# 0x75, 0x08,                    //  Report Size (8)                    24
# 0x81, 0x01,                    //  Input (Cnst,Arr,Abs)               26
# 0x95, 0x03,                    //  Report Count (3)                   28
# 0x75, 0x01,                    //  Report Size (1)                    30
# 0x05, 0x08,                    //  Usage Page (LEDs)                  32
# 0x19, 0x01,                    //  Usage Minimum (1)                  34
# 0x29, 0x03,                    //  Usage Maximum (3)                  36
# 0x91, 0x02,                    //  Output (Data,Var,Abs)              38
# 0x95, 0x05,                    //  Report Count (5)                   40
# 0x75, 0x01,                    //  Report Size (1)                    42
# 0x91, 0x01,                    //  Output (Cnst,Arr,Abs)              44
# 0x95, 0x06,                    //  Report Count (6)                   46
# 0x75, 0x08,                    //  Report Size (8)                    48
# 0x15, 0x00,                    //  Logical Minimum (0)                50
# 0x26, 0xff, 0x00,              //  Logical Maximum (255)              52
# 0x05, 0x07,                    //  Usage Page (Keyboard)              55
# 0x19, 0x00,                    //  Usage Minimum (0)                  57
# 0x2a, 0xff, 0x00,              //  Usage Maximum (255)                59
# 0x81, 0x00,                    //  Input (Data,Arr,Abs)               62
# 0xc0,                          // End Collection                      64
#
R: 65 05 01 09 06 a1 01 05 07 19 e0 29 e7 15 00 25 01 75 01 95 08 81 02 95 01 75 08 81 01 95 03 75 01 05 08 19 01 29 03 91 02 95 05 75 01 91 01 95 06 75 08 15 00 26 ff 00 05 07 19 00 2a ff 00 81 00 c0
N: CM Storm Quickfire TKL 6keys
I: 3 2516 0011
#  LeftControl: 0 | LeftShift: 0 | LeftAlt: 0 | Left GUI: 0 | RightControl: 0 | RightShift: 0 | RightAlt: 0 | Right GUI: 0 | # |Keyboard ['Caps Lock', '0x70000', '0x70000', '0x70000', '0x70000', '0x70000']
E: 000000.000000 8 00 00 39 00 00 00 00 00
#  LeftControl: 0 | LeftShift: 0 | LeftAlt: 0 | Left GUI: 0 | RightControl: 0 | RightShift: 0 | RightAlt: 0 | Right GUI: 0 | # |Keyboard ['0x70000', '0x70000', '0x70000', '0x70000', '0x70000', '0x70000']
E: 000000.051601 8 00 00 00 00 00 00 00 00
#  LeftControl: 0 | LeftShift: 0 | LeftAlt: 0 | Left GUI: 0 | RightControl: 0 | RightShift: 0 | RightAlt: 0 | Right GUI: 0 | # |Keyboard ['Caps Lock', '0x70000', '0x70000', '0x70000', '0x70000', '0x70000']
E: 000007.485996 8 00 00 39 00 00 00 00 00
#  LeftControl: 0 | LeftShift: 0 | LeftAlt: 0 | Left GUI: 0 | RightControl: 0 | RightShift: 0 | RightAlt: 0 | Right GUI: 0 | # |Keyboard ['0x70000', '0x70000', '0x70000', '0x70000', '0x70000', '0x70000']
E: 000007.568773 8 00 00 00 00 00 00 00 00
#  LeftControl: 0 | LeftShift: 0 | LeftAlt: 0 | Left GUI: 0 | RightControl: 0 | RightShift: 0 | RightAlt: 0 | Right GUI: 0 | # |Keyboard ['Keypad Num Lock and Clear', '0x70000', '0x70000', '0x70000', '0x70000', '0x70000']
E: 000008.838086 8 00 00 53 00 00 00 00 00
#  LeftControl: 0 | LeftShift: 0 | LeftAlt: 0 | Left GUI: 0 | RightControl: 0 | RightShift: 0 | RightAlt: 0 | Right GUI: 0 | # |Keyboard ['0x70000', '0x70000', '0x70000', '0x70000', '0x70000', '0x70000']
E: 000008.901684 8 00 00 00 00 00 00 00 00
#  LeftControl: 0 | LeftShift: 0 | LeftAlt: 0 | Left GUI: 0 | RightControl: 0 | RightShift: 0 | RightAlt: 0 | Right GUI: 0 | # |Keyboard ['Scroll Lock', '0x70000', '0x70000', '0x70000', '0x70000', '0x70000']
E: 000010.420901 8 00 00 47 00 00 00 00 00
#  LeftControl: 0 | LeftShift: 0 | LeftAlt: 0 | Left GUI: 0 | RightControl: 0 | RightShift: 0 | RightAlt: 0 | Right GUI: 0 | # |Keyboard ['0x70000', '0x70000', '0x70000', '0x70000', '0x70000', '0x70000']
E: 000010.507058 8 00 00 00 00 00 00 00 00
#  LeftControl: 1 | LeftShift: 0 | LeftAlt: 0 | Left GUI: 0 | RightControl: 0 | RightShift: 0 | RightAlt: 0 | Right GUI: 0 | # |Keyboard ['0x70000', '0x70000', '0x70000', '0x70000', '0x70000', '0x70000']
E: 000013.531074 8 01 00 00 00 00 00 00 00
#  LeftControl: 1 | LeftShift: 0 | LeftAlt: 0 | Left GUI: 0 | RightControl: 0 | RightShift: 0 | RightAlt: 0 | Right GUI: 0 | # |Keyboard ['c and C', '0x70000', '0x70000', '0x70000', '0x70000', '0x70000']
E: 000013.628813 8 01 00 06 00 00 00 00 00
